Código do Item,Descrição do Item,Grupo,Classe,PDM,Status,Sustentável
103128,"SISTEMA DE LIMPEZA / MANUTENCAO DE MATERIAL BELICO PORTATIL, SISTEMA DE LIMPEZA / MANUTENCAO DE MATER NOME","10: ARMAMENTO                                                                                                               ","1095: ARMAMENTOS DIVERSOS                                                                                                     ","12124: SISTEMA DE LIMPEZA / MANUTENCAO DE MATERIAL BELICO PORTATIL                                         ",Ativo,Não
103268,"PEÇAS / COMPONENTES CANHÃO, CANHAO NOME","10: ARMAMENTO                                                                                                               ","1020: ARMAS DE FOGO DE CALIBRE ACIMA DE 125MM ATÉ 150MM                                                                       ","04419: PEÇAS / COMPONENTES CANHÃO                                                                          ",Ativo,Não
108,"FUZIS, FUZIS NOME","10: ARMAMENTO                                                                                                               ","1005: ARMAS DE FOGO DE CALIBRE ATÉ 120MM                                                                                      ","07889: FUZIS                                                                                               ",Ativo,Não
113352,"COMPONENTE / SOBRESSALENTE  USO MILITAR, SOBRESSALENTE - USO MILITAR NOME","10: ARMAMENTO                                                                                                               ","1095: ARMAMENTOS DIVERSOS                                                                                                     ","12172: COMPONENTE / SOBRESSALENTE  USO MILITAR                                                             ",Ativo,Não
116,"RIFLES, RIFLES NOME","10: ARMAMENTO                                                                                                               ","1005: ARMAS DE FOGO DE CALIBRE ATÉ 120MM                                                                                      ","11747: RIFLES                                                                                              ",Ativo,Não
132,"TAMBORES, TAMBORES NOME","10: ARMAMENTO                                                                                                               ","1005: ARMAS DE FOGO DE CALIBRE ATÉ 120MM                                                                                      ","12505: TAMBORES                                                                                            ",Ativo,Não
136344,"CARREGADOR PARA MUNIÇÃO, CARREGADOR METALICO - PISTOLA NOME","10: ARMAMENTO                                                                                                               ","1010: ARMAS DE FOGO DE CALIBRE ACIMA DE 30MM ATÉ 75MM                                                                         ","04570: CARREGADOR PARA MUNIÇÃO                                                                             ",Ativo,Não
150877,"PEÇAS / ACESSÓRIOS ARMAMENTO, PEÇAS / ACESSÓRIOS ARMAMENTO NOME","10: ARMAMENTO                                                                                                               ","1005: ARMAS DE FOGO DE CALIBRE ATÉ 120MM                                                                                      ","01712: PEÇAS / ACESSÓRIOS ARMAMENTO                                                                        ",Ativo,Não
150913,"ARMA NÃO LETAL, ARMA NÃO LETAL NOME","10: ARMAMENTO                                                                                                               ","1095: ARMAMENTOS DIVERSOS                                                                                                     ","16657: ARMA NÃO LETAL                                                                                      ",Ativo,Não
151015,"ESPARGIDOR DEFENSIVO, ESPARGIDOR DEFENSIVO NOME","10: ARMAMENTO                                                                                                               ","1040: ARMAMENTO E EQUIPAMENTOS DE GUERRA QUÍMICA                                                                              ","17996: ESPARGIDOR DEFENSIVO                                                                                ",Ativo,Não
159,"SILENCIADORES, SILENCIADORES NOME","10: ARMAMENTO                                                                                                               ","1005: ARMAS DE FOGO DE CALIBRE ATÉ 120MM                                                                                      ","12060: SILENCIADORES                                                                                       ",Ativo,Não
191005,"ARMA NÃO LETAL, ARMAS DE FOGO DE CALIBRE ATÉ 30MM NOME","10: ARMAMENTO                                                                                                               ","1095: ARMAMENTOS DIVERSOS                                                                                                     ","16657: ARMA NÃO LETAL                                                                                      ",Inativo,Não
191010,"ARMAS DE FOGO DE CALIBRE ACIMA DE 30MM ATÉ 75MM, ARMAS DE FOGO DE CALIBRE ACIMA DE 30MM A NOME","10: ARMAMENTO                                                                                                               ","1010: ARMAS DE FOGO DE CALIBRE ACIMA DE 30MM ATÉ 75MM                                                                         ","16658: ARMAS DE FOGO DE CALIBRE ACIMA DE 30MM ATÉ 75MM                                                     ",Ativo,Não
191015,"ARMAS DE FOGO DE CALIBRE ACIMA DE 75MM ATÉ 125MM, ARMAS DE FOGO DE CALIBRE ACIMA DE 75MM A NOME","10: ARMAMENTO                                                                                                               ","1015: ARMAS DE FOGO DE CALIBRE ACIMA DE 75MM ATÉ 125MM                                                                        ","16659: ARMAS DE FOGO DE CALIBRE ACIMA DE 75MM ATÉ 125MM                                                    ",Ativo,Não
191020,"ARMAS DE FOGO DE CALIBRE ACIMA DE 125MM ATÉ 150MM, ARMAS DE FOGO DE CALIBRE ACIMA DE 125MM NOME","10: ARMAMENTO                                                                                                               ","1020: ARMAS DE FOGO DE CALIBRE ACIMA DE 125MM ATÉ 150MM                                                                       ","16660: ARMAS DE FOGO DE CALIBRE ACIMA DE 125MM ATÉ 150MM                                                   ",Ativo,Não
191025,"ARMAS DE FOGO DE CALIBRE ACIMA DE 150MM ATÉ 200MM, ARMAS DE FOGO DE CALIBRE ACIMA DE 150MM NOME","10: ARMAMENTO                                                                                                               ","1025: ARMAS DE FOGO DE CALIBRE ACIMA DE 150MM ATÉ 200MM                                                                       ","16661: ARMAS DE FOGO DE CALIBRE ACIMA DE 150MM ATÉ 200MM                                                   ",Inativo,Não
191030,"ARMAS DE FOGO DE CALIBRE ACIMA DE 200MM ATÉ 300MM, ARMAS DE FOGO DE CALIBRE ACIMA DE 200MM NOME","10: ARMAMENTO                                                                                                               ","1030: ARMAS DE FOGO DE CALIBRE ACIMA DE 200MM ATÉ 300MM                                                                       ","16662: ARMAS DE FOGO DE CALIBRE ACIMA DE 200MM ATÉ 300MM                                                   ",Inativo,Não
191035,"ARMAS DE FOGO DE CALIBRE ACIMA DE 300MM, ARMAS DE FOGO DE CALIBRE ACIMA DE 300MM NOME","10: ARMAMENTO                                                                                                               ","1035: ARMAS DE FOGO DE CALIBRE ACIMA DE 300MM                                                                                 ","16663: ARMAS DE FOGO DE CALIBRE ACIMA DE 300MM                                                             ",Inativo,Não
191040,"ARMAMENTO E EQUIPAMENTOS DE GUERRA QUÍMICA, ARMAMENTO E EQUIPAMENTOS DE GUERRA QUÍMI NOME","10: ARMAMENTO                                                                                                               ","1040: ARMAMENTO E EQUIPAMENTOS DE GUERRA QUÍMICA                                                                              ","16664: ARMAMENTO E EQUIPAMENTOS DE GUERRA QUÍMICA                                                          ",Inativo,Não
191045,"LANÇADORES DE TORPEDOS E DE BOMBAS DE PROFUNDIDADE, LANÇADORES DE TORPEDOS E DE BOMBAS DE PR NOME","10: ARMAMENTO                                                                                                               ","1045: LANÇADORES DE TORPEDOS E DE BOMBAS DE PROFUNDIDADE                                                                      ","16665: LANÇADORES DE TORPEDOS E DE BOMBAS DE PROFUNDIDADE                                                  ",Inativo,Não
191055,"LANÇADORES DE FOGUETES E PIROTÉCNICOS, LANÇADORES DE FOGUETES E PIROTÉCNICOS NOME","10: ARMAMENTO                                                                                                               ","1055: LANÇADORES DE FOGUETES E PIROTÉCNICOS                                                                                   ","16666: LANÇADORES DE FOGUETES E PIROTÉCNICOS                                                               ",Inativo,Não
191070,"REDES SUBMARINAS DE DEFESA DE PORTOS, REDES SUBMARINAS DE DEFESA DE PORTOS NOME","10: ARMAMENTO                                                                                                               ","1070: REDES SUBMARINAS DE DEFESA DE PORTOS                                                                                    ","16667: REDES SUBMARINAS DE DEFESA DE PORTOS                                                                ",Inativo,Não
191075,"EQUIPAMENTOS DE DESMAGNETIZAÇÃO E DE VARREDURA DE MINAS, EQUIPAMENTOS DE DESMAGNETIZAÇÃO E DE VAR NOME","10: ARMAMENTO                                                                                                               ","1075: EQUIPAMENTOS DE DESMAGNETIZAÇÃO E DE VARREDURA DE MINAS                                                                 ","16668: EQUIPAMENTOS DE DESMAGNETIZAÇÃO E DE VARREDURA DE MINAS                                             ",Inativo,Não
191080,"ACESSÓRIO/EQUIPAMENTO CAMUFLAGEM E DISSIMULAÇÃO, EQUIPAMENTOS DE CAMUFLAGEM E DE DISSIMUL NOME","10: ARMAMENTO                                                                                                               ","1080: EQUIPAMENTOS DE CAMUFLAGEM E DE DISSIMULAÇÃO                                                                            ","16669: ACESSÓRIO/EQUIPAMENTO CAMUFLAGEM E DISSIMULAÇÃO                                                     ",Ativo,Não
191090,"CONJUNTOS INTERCAMBIÁVEIS DE DUAS OU MAIS CLASSES, CONJUNTOS INTERCAMBIÁVEIS DE DUAS OU MAI NOME","10: ARMAMENTO                                                                                                               ","1090: CONJUNTOS INTERCAMBIÁVEIS DE DUAS OU MAIS CLASSES                                                                       ","16670: CONJUNTOS INTERCAMBIÁVEIS DE DUAS OU MAIS CLASSES                                                   ",Inativo,Não
227483,"REFORÇADOR TIRO FESTIM, MATERIAL AÇO FLEXÍVEL  TIPO ESPIRAL  FUNÇÃO BLOQUEAR SAÍDA CANO ARMA,  FIM   MANTER    PRESSÃO  APLICAÇÃO FUZIL CALIBRE 5,56 MM/MODELO M16 A 2","10: ARMAMENTO                                                                                                               ","1005: ARMAS DE FOGO DE CALIBRE ATÉ 120MM                                                                                      ","13799: REFORÇADOR TIRO FESTIM                                                                              ",Ativo,Não
227485,"MOLA EJETOR, MATERIAL AÇO FLEXÍVEL  TIPO ESPIRAL  FUNÇÃO PERMITIR MOVIMENTO EJETOR  APLICAÇÃO SISTEMA   EXTRAÇÃO  CARABINA  CALIBRE  5,56  MM  /","10: ARMAMENTO                                                                                                               ","1005: ARMAS DE FOGO DE CALIBRE ATÉ 120MM                                                                                      ","13800: MOLA EJETOR                                                                                         ",Ativo,Não
227486,"EJETOR, MATERIAL AÇO CARBONO  FUNÇÃO LIBERAR CÁPSULA DEFLAGRADA DA GARRA DE EJEÇÃO  APLICAÇÃO SISTEMA TOMADA GASES CARABINA CALIBRE 5,56 MM","10: ARMAMENTO                                                                                                               ","1005: ARMAS DE FOGO DE CALIBRE ATÉ 120MM                                                                                      ","13801: EJETOR                                                                                              ",Ativo,Não
227487,"PINO SEGURANÇA MIRA, MATERIAL AÇO CARBONO  FUNÇÃO FIXAR REGULAGEM MIRA DIANTEIRA  APLICAÇÃO SISTEMA PONTARIA CARABINA CALIBRE  5,56 MM/ MODELO","10: ARMAMENTO                                                                                                               ","1005: ARMAS DE FOGO DE CALIBRE ATÉ 120MM                                                                                      ","13802: PINO SEGURANÇA MIRA                                                                                 ",Ativo,Não
227488,"PINO TUBO TOMADA GÁS, MATERIAL AÇO CARBONO  FUNÇÃO FIXAR TUBO DE GÁS  APLICAÇÃO SISTEMA TOMADA GASES CARABINA CALIBRE 5,56 MM","10: ARMAMENTO                                                                                                               ","1005: ARMAS DE FOGO DE CALIBRE ATÉ 120MM                                                                                      ","13803: PINO TUBO TOMADA GÁS                                                                                ",Ativo,Não
227505,"ANEL FERROLHO, MATERIAL AÇO  FUNÇÃO VEDAR GASES DO FERROLHO  APLICAÇÃO SISTEMA ALIMENTAÇÃO CARABINA CALIBRE 5,56 MM/","10: ARMAMENTO                                                                                                               ","1005: ARMAS DE FOGO DE CALIBRE ATÉ 120MM                                                                                      ","13794: ANEL FERROLHO                                                                                       ",Ativo,Não
227506,"CHAVE FERROLHO, MATERIAL AÇO CARBONO  FUNÇÃO FIXAR CABEÇA DO FERROLHO AO FERROLHO  APLICAÇÃO SISTEMA ALIMENTAÇÃO CARABINA CALIBRE 5,56 MM/","10: ARMAMENTO                                                                                                               ","1005: ARMAS DE FOGO DE CALIBRE ATÉ 120MM                                                                                      ","13795: CHAVE FERROLHO                                                                                      ",Ativo,Não
227507,"EXTRATOR CÁPSULA, MATERIAL AÇO CARBONO  TIPO GARRA  TIPO ACIONAMENTO POR MOLA  FUNÇÃO EXTRAIR CÁPSULA DEFLAGRADA INTERIOR DA CÂMARA  APLICAÇÃO SISTEMA EXTRAÇÃO CARABINA CALIBRE 5,56 MM/","10: ARMAMENTO                                                                                                               ","1005: ARMAS DE FOGO DE CALIBRE ATÉ 120MM                                                                                      ","13796: EXTRATOR CÁPSULA                                                                                    ",Ativo,Não
227508,"PERCUSSOR, MATERIAL AÇO  TIPO HASTE  FUNÇÃO ACIONAR ESPOLETA DA MUNIÇÃO  APLICAÇÃO SISTEMA DISPARO CARABINA CALIBRE 5,56MM/","10: ARMAMENTO                                                                                                               ","1005: ARMAS DE FOGO DE CALIBRE ATÉ 120MM                                                                                      ","13810: PERCUSSOR                                                                                           ",Ativo,Não
227510,"INSERSOR MOLA EXTRATOR, MATERIAL BORRACHA  TIPO CALÇO  FUNÇÃO FIXAR MOLA DO EXTRATOR  APLICAÇÃO SISTEMA EXTRAÇÃO CARABINA CALIBRE 5,56 MM/","10: ARMAMENTO                                                                                                               ","1005: ARMAS DE FOGO DE CALIBRE ATÉ 120MM                                                                                      ","13809: INSERSOR MOLA EXTRATOR                                                                              ",Ativo,Não
227511,"MOLA EXTRATOR, MATERIAL AÇO FLEXÍVEL  TIPO ESPIRAL  FUNÇÃO ACIONAR EXTRATOR  APLICAÇÃO SISTEMA EXTRAÇÃO CARABINA CALIBRE 5,56 MM/","10: ARMAMENTO                                                                                                               ","1005: ARMAS DE FOGO DE CALIBRE ATÉ 120MM                                                                                      ","13808: MOLA EXTRATOR                                                                                       ",Ativo,Não
227523,"TUBO TOMADA GÁS, MATERIAL AÇO RÍGIDO  FUNÇÃO ENCAMINHAR GASES  RESULTANTES  CÁPSULA  DEFLAGRADA  APLICAÇÃO SISTEMA TOMADA GASES ALIMENTAÇÃO CARABINA","10: ARMAMENTO                                                                                                               ","1005: ARMAS DE FOGO DE CALIBRE ATÉ 120MM                                                                                      ","13797: TUBO TOMADA GÁS                                                                                     ",Ativo,Não
230,"BAINHA FACÃO CAÇA, BAINHAS PARA FACOES DE CACA NOME","10: ARMAMENTO                                                                                                               ","1095: ARMAMENTOS DIVERSOS                                                                                                     ","03204: BAINHA FACÃO CAÇA                                                                                   ",Ativo,Não
23000,"FOLE PARA CANHAO, FOLE PARA CANHAO NOME","10: ARMAMENTO                                                                                                               ","1095: ARMAMENTOS DIVERSOS                                                                                                     ","07688: FOLE PARA CANHAO                                                                                    ",Ativo,Não
230202,"MOLA RECUPERADORA, MATERIAL MOLA ESPIRAL AÇO FLEXÍVEL  COMPONENTES MOLA ESPIRAL, GUIA MOLA ESPIRAL, ANÉIS E PINOS  MATERIAL GUIA MOLA ESPIRAL AÇO  MATERIAL ANEL PLÁSTICO  MATERIAL PINO AÇO  TIPO CABEÇA PINO CHATA  APLICAÇÃO SISTEMA DE ALIMENTAÇÃO DA SUBMETRALHADORA HK 5A5","10: ARMAMENTO                                                                                                               ","1005: ARMAS DE FOGO DE CALIBRE ATÉ 120MM                                                                                      ","14112: MOLA RECUPERADORA                                                                                   ",Ativo,Não
230207,"EMPUNHADURA METRALHADORA, MATERIAL PLÁSTICO ENDURECIDO  COMPONENTES MECANISMO DE DISPARO E SELETOR DE 4 POSIÇÕES  APLICAÇÃO SISTEMA DE DISPARO DA SUBMETRALHADORA HK MP5A5","10: ARMAMENTO                                                                                                               ","1005: ARMAS DE FOGO DE CALIBRE ATÉ 120MM                                                                                      ","14115: EMPUNHADURA METRALHADORA                                                                            ",Ativo,Não
230208,"EXTRATOR CÁPSULA, MATERIAL AÇO ENDURECIDO  TIPO GARRA  TIPO ACIONAMENTO POR MOLA  FUNÇÃO EXTRAIR CÁPSULA DEFLAGRADA INTERIOR DA CÂMARA  APLICAÇÃO SISTEMA DE EXTRAÇÃO DA SUBMETRALHADORA HK MP5A5","10: ARMAMENTO                                                                                                               ","1005: ARMAS DE FOGO DE CALIBRE ATÉ 120MM                                                                                      ","13796: EXTRATOR CÁPSULA                                                                                    ",Ativo,Não
230217,"MOLA EXTRATOR, MATERIAL AÇO FLEXÍVEL  TIPO ESPIRAL  FUNÇÃO ACIONAR EXTRATOR  APLICAÇÃO SISTEMA DE EXTRAÇÃO DA SUBMETRALHADORA HK MP5A5","10: ARMAMENTO                                                                                                               ","1005: ARMAS DE FOGO DE CALIBRE ATÉ 120MM                                                                                      ","13808: MOLA EXTRATOR                                                                                       ",Ativo,Não
230259,"MOLA PERCUSSOR, MATERIAL AÇO FLEXÍVEL  FUNÇÃO RETORNAR PERCUSSOR À POSIÇÃO INICIAL  APLICAÇÃO SISTEMA DE DISPARO DA SUBMETRALHADORA HK MP5A5  TIPO ESPIRAL","10: ARMAMENTO                                                                                                               ","1005: ARMAS DE FOGO DE CALIBRE ATÉ 120MM                                                                                      ","14123: MOLA PERCUSSOR                                                                                      ",Ativo,Não
230260,"PERCUSSOR, MATERIAL AÇO  TIPO HASTE  FUNÇÃO ACIONAR A ESPOLETA DO CARTUCHO  APLICAÇÃO SISTEMA DE DISPARO DA SUBMETRALHADORA HK MP5A5","10: ARMAMENTO                                                                                                               ","1005: ARMAS DE FOGO DE CALIBRE ATÉ 120MM                                                                                      ","13810: PERCUSSOR                                                                                           ",Ativo,Não
230261,"SUPORTE ROLETE, MATERIAL AÇO  FUNÇÃO FIXAR ROLETE NA CABEÇA DO FERROLHO","10: ARMAMENTO                                                                                                               ","1005: ARMAS DE FOGO DE CALIBRE ATÉ 120MM                                                                                      ","14129: SUPORTE ROLETE                                                                                      ",Ativo,Não
230262,"GUARDA-MÃO SUBMETRALHADORA, MATERIAL PLÁSTICO INJETADO  APLICAÇÃO SISTEMA DE EMPUNHADURA DA SUBMETRALHADORA HK MP5A5","10: ARMAMENTO                                                                                                               ","1005: ARMAS DE FOGO DE CALIBRE ATÉ 120MM                                                                                      ","14124: GUARDA-MÃO SUBMETRALHADORA                                                                          ",Ativo,Não
230263,"BANDOLEIRA, MATERIAL LONA  APLICAÇÃO SISTEMA DE TRANSPORTE DA SUBMETRALHADORA HK MP5A5","10: ARMAMENTO                                                                                                               ","1005: ARMAS DE FOGO DE CALIBRE ATÉ 120MM                                                                                      ","14125: BANDOLEIRA                                                                                          ",Ativo,Não
230576,"FACA OPERAÇÃO TÁTICA, MATERIAL LÂMINA AÇO CARBONO (LIGA DO TIPO SIGO)  MATERIAL GUARDA LATÃO  MATERIAL POMO LATÃO  MATERIAL CABO MADEIRA  MATERIAL BAINHA EXTERIOR COURO  COR BAINHA PRETA  COMPRIMENTO FIO LÂMINA 20 CM COMPRIMENTO CABO 12,50 CM ESPESSURA LÂMINA 5 MM TÊMPERA LÂMINA 58 HRC  APLICAÇÃO COMANDO OPERAÇÕES TÁTICAS  CARACTERÍSTICAS ADICIONAIS DESBASTE DO FIO TIPO HOLLOW GROUND/DESBASTE PARTE","10: ARMAMENTO                                                                                                               ","1095: ARMAMENTOS DIVERSOS                                                                                                     ","14174: FACA OPERAÇÃO TÁTICA                                                                                ",Ativo,Não
233416,"EXTRATOR CÁPSULA, MATERIAL AÇO ENDURECIDO  TIPO GARRA  TIPO ACIONAMENTO POR MOLA  FUNÇÃO EXTRAIR CÁPSULA DEFLAGRADA INTERIOR DA CÂMARA  APLICAÇÃO PISTOLA TAURUS - MOD.PT92AF","10: ARMAMENTO                                                                                                               ","1005: ARMAS DE FOGO DE CALIBRE ATÉ 120MM                                                                                      ","13796: EXTRATOR CÁPSULA                                                                                    ",Ativo,Não
233417,"MOLA EXTRATOR, MATERIAL AÇO FLEXÍVEL  TIPO ESPIRAL  FUNÇÃO ACIONAR EXTRATOR  APLICAÇÃO PISTOLA TAURUS - MOD.PT92AF","10: ARMAMENTO                                                                                                               ","1005: ARMAS DE FOGO DE CALIBRE ATÉ 120MM                                                                                      ","13808: MOLA EXTRATOR                                                                                       ",Ativo,Não
